[
  {
    "id": "racionales-suma-resta-01",
    "modulo": "racionales",
    "subtema": "suma-resta",
    "dificultad": 1,
    "tipo": "paso-a-paso",
    "enunciado": "Calcula 2/5 + 1/5. Escribe el resultado en la forma a/b (sin espacios).",
    "pasos": [
      { "texto": "2/5 + 1/5 =", "esperado": "3/5" }
    ],
    "pistas": ["Mismo denominador: solo se suman los numeradores."],
    "explicacion": "2/5 + 1/5 = 3/5."
  },
  {
    "id": "racionales-suma-resta-02",
    "modulo": "racionales",
    "subtema": "suma-resta",
    "dificultad": 2,
    "tipo": "paso-a-paso",
    "enunciado": "Calcula 1/2 + 1/3. Escribe el resultado en la forma a/b (sin espacios).",
    "pasos": [
      { "texto": "1/2 + 1/3 =", "esperado": "5/6" }
    ],
    "pistas": ["Usa el mcm(2,3)=6 como denominador común: 1/2=3/6 y 1/3=2/6."],
    "explicacion": "3/6 + 2/6 = 5/6."
  },
  {
    "id": "racionales-suma-resta-03",
    "modulo": "racionales",
    "subtema": "suma-resta",
    "dificultad": 2,
    "tipo": "paso-a-paso",
    "enunciado": "Calcula 3/4 − 1/6. Escribe el resultado en la forma a/b (sin espacios).",
    "pasos": [
      { "texto": "3/4 − 1/6 =", "esperado": "7/12" }
    ],
    "pistas": ["Usa el mcm(4,6)=12: 3/4=9/12 y 1/6=2/12."],
    "explicacion": "9/12 − 2/12 = 7/12."
  },
  {
    "id": "racionales-suma-resta-04",
    "modulo": "racionales",
    "subtema": "suma-resta",
    "dificultad": 1,
    "tipo": "paso-a-paso",
    "enunciado": "Un pastel se divide en octavos. Comiste 3/8 en la mañana y 2/8 en la tarde. ¿Qué fracción del pastel comiste en total? Escribe la fracción en la forma a/b.",
    "pasos": [
      { "texto": "3/8 + 2/8 =", "esperado": "5/8" }
    ],
    "pistas": ["Mismo denominador (octavos): suma los numeradores."],
    "explicacion": "3/8 + 2/8 = 5/8 del pastel."
  },
  {
    "id": "racionales-suma-resta-05",
    "modulo": "racionales",
    "subtema": "suma-resta",
    "dificultad": 1,
    "tipo": "paso-a-paso",
    "enunciado": "Calcula 5/9 − 2/9 y simplifica el resultado. Escribe la fracción en la forma a/b (sin espacios).",
    "pasos": [
      { "texto": "5/9 − 2/9 =", "esperado": "1/3" }
    ],
    "pistas": ["Mismo denominador: resta los numeradores y luego simplifica 3/9."],
    "explicacion": "5/9 − 2/9 = 3/9, que simplificado (÷3) es 1/3."
  },
  {
    "id": "racionales-suma-resta-06",
    "modulo": "racionales",
    "subtema": "suma-resta",
    "dificultad": 3,
    "tipo": "paso-a-paso",
    "enunciado": "Calcula 2/3 + 3/4 − 1/6. Escribe el resultado en la forma a/b (sin espacios).",
    "pasos": [
      { "texto": "2/3 + 3/4 − 1/6 =", "esperado": "5/4" }
    ],
    "pistas": ["Usa el mcm(3,4,6)=12: 2/3=8/12, 3/4=9/12, 1/6=2/12."],
    "explicacion": "8/12 + 9/12 − 2/12 = 15/12 = 5/4."
  },
  {
    "id": "racionales-suma-resta-07",
    "modulo": "racionales",
    "subtema": "suma-resta",
    "dificultad": 3,
    "tipo": "paso-a-paso",
    "enunciado": "Un tanque tiene lleno 5/6 de su capacidad. Se usa 1/4 de la capacidad total. ¿Qué fracción de la capacidad queda? Escribe la fracción en la forma a/b.",
    "pasos": [
      { "texto": "5/6 − 1/4 =", "esperado": "7/12" }
    ],
    "pistas": ["Usa el mcm(6,4)=12: 5/6=10/12 y 1/4=3/12."],
    "explicacion": "10/12 − 3/12 = 7/12 de la capacidad."
  }
]
