[
  {
    "id": "racionales-equivalencia-01",
    "modulo": "racionales",
    "subtema": "equivalencia-simplificacion",
    "dificultad": 2,
    "tipo": "paso-a-paso",
    "enunciado": "Simplifica 18/24 usando su MCD.",
    "pasos": [
      { "texto": "MCD(18,24) =", "esperado": "6" },
      { "texto": "18 ÷ 6 =", "esperado": "3" },
      { "texto": "24 ÷ 6 =", "esperado": "4" }
    ],
    "pistas": ["Descompón 18 y 24 en factores primos para hallar su MCD."],
    "explicacion": "MCD(18,24)=6, así que 18/24 = 3/4."
  },
  {
    "id": "racionales-equivalencia-02",
    "modulo": "racionales",
    "subtema": "equivalencia-simplificacion",
    "dificultad": 1,
    "tipo": "verdadero-falso",
    "enunciado": "3/4 y 6/8 son fracciones equivalentes.",
    "opciones": [
      { "id": "v", "texto": "Verdadero" },
      { "id": "f", "texto": "Falso" }
    ],
    "respuesta": "v",
    "pistas": ["Dos fracciones a/b y c/d son equivalentes si a×d = b×c."],
    "explicacion": "3×8=24 y 4×6=24. Como son iguales, las fracciones son equivalentes."
  },
  {
    "id": "racionales-equivalencia-03",
    "modulo": "racionales",
    "subtema": "equivalencia-simplificacion",
    "dificultad": 1,
    "tipo": "paso-a-paso",
    "enunciado": "Amplifica 2/5 multiplicando numerador y denominador por 3. Escribe la fracción resultante en la forma a/b.",
    "pasos": [
      { "texto": "2/5 =", "esperado": "6/15" }
    ],
    "pistas": ["Multiplica tanto el numerador como el denominador por 3."],
    "explicacion": "2×3=6 y 5×3=15, así que 2/5 = 6/15."
  },
  {
    "id": "racionales-equivalencia-04",
    "modulo": "racionales",
    "subtema": "equivalencia-simplificacion",
    "dificultad": 2,
    "tipo": "opcion-multiple",
    "enunciado": "¿Cuál de estas fracciones es equivalente a 5/10?",
    "opciones": [
      { "id": "a", "texto": "1/2" },
      { "id": "b", "texto": "2/3" },
      { "id": "c", "texto": "3/4" },
      { "id": "d", "texto": "5/6" }
    ],
    "respuesta": "a",
    "pistas": ["Simplifica 5/10 primero."],
    "explicacion": "5/10 = 1/2 al dividir numerador y denominador por 5."
  },
  {
    "id": "racionales-equivalencia-05",
    "modulo": "racionales",
    "subtema": "equivalencia-simplificacion",
    "dificultad": 2,
    "tipo": "paso-a-paso",
    "enunciado": "Simplifica 24/36 usando su MCD. Escribe la fracción simplificada en la forma a/b.",
    "pasos": [
      { "texto": "24/36 =", "esperado": "2/3" }
    ],
    "pistas": ["Descompón 24 y 36 en factores primos para hallar su MCD."],
    "explicacion": "MCD(24,36)=12; 24÷12=2 y 36÷12=3, así 24/36 = 2/3."
  },
  {
    "id": "racionales-equivalencia-06",
    "modulo": "racionales",
    "subtema": "equivalencia-simplificacion",
    "dificultad": 1,
    "tipo": "verdadero-falso",
    "enunciado": "4/6 y 2/3 son fracciones equivalentes.",
    "opciones": [
      { "id": "v", "texto": "Verdadero" },
      { "id": "f", "texto": "Falso" }
    ],
    "respuesta": "v",
    "pistas": ["Compara los productos cruzados: 4×3 y 6×2."],
    "explicacion": "4×3=12 y 6×2=12. Como son iguales, las fracciones son equivalentes (4/6 simplifica a 2/3)."
  },
  {
    "id": "racionales-equivalencia-07",
    "modulo": "racionales",
    "subtema": "equivalencia-simplificacion",
    "dificultad": 2,
    "tipo": "paso-a-paso",
    "enunciado": "Simplifica 45/60 usando su MCD.",
    "pasos": [
      { "texto": "MCD(45,60) =", "esperado": "15" },
      { "texto": "45 ÷ 15 =", "esperado": "3" },
      { "texto": "60 ÷ 15 =", "esperado": "4" }
    ],
    "pistas": ["45 = 3²×5 y 60 = 2²×3×5; el MCD toma los factores comunes con su menor exponente."],
    "explicacion": "MCD(45,60)=15, así que 45/60 = 3/4."
  }
]
