[
  {
    "id": "racionales-multiplicacion-division-01",
    "modulo": "racionales",
    "subtema": "multiplicacion-division",
    "dificultad": 1,
    "tipo": "paso-a-paso",
    "enunciado": "Calcula 2/3 × 3/5 y simplifica el resultado. Escribe la fracción en la forma a/b.",
    "pasos": [
      { "texto": "2/3 × 3/5 =", "esperado": "2/5" }
    ],
    "pistas": ["Multiplica numeradores entre sí y denominadores entre sí, luego simplifica: 6/15."],
    "explicacion": "2×3=6, 3×5=15, y 6/15 simplificado (÷3) es 2/5."
  },
  {
    "id": "racionales-multiplicacion-division-02",
    "modulo": "racionales",
    "subtema": "multiplicacion-division",
    "dificultad": 1,
    "tipo": "paso-a-paso",
    "enunciado": "Calcula 4/9 × 3/8 y simplifica el resultado. Escribe la fracción en la forma a/b.",
    "pasos": [
      { "texto": "4/9 × 3/8 =", "esperado": "1/6" }
    ],
    "pistas": ["4×3=12, 9×8=72. Simplifica 12/72."],
    "explicacion": "12/72 simplificado (÷12) es 1/6."
  },
  {
    "id": "racionales-multiplicacion-division-03",
    "modulo": "racionales",
    "subtema": "multiplicacion-division",
    "dificultad": 2,
    "tipo": "paso-a-paso",
    "enunciado": "Calcula 3/4 ÷ 2/5 (multiplica por el recíproco). Escribe la fracción en la forma a/b.",
    "pasos": [
      { "texto": "3/4 ÷ 2/5 =", "esperado": "15/8" }
    ],
    "pistas": ["Dividir entre 2/5 es multiplicar por 5/2."],
    "explicacion": "3/4 × 5/2 = 15/8, que ya está simplificada."
  },
  {
    "id": "racionales-multiplicacion-division-04",
    "modulo": "racionales",
    "subtema": "multiplicacion-division",
    "dificultad": 3,
    "tipo": "paso-a-paso",
    "enunciado": "Se reparten 3/4 de litro de jugo en partes iguales entre 3 personas. ¿Qué fracción de litro recibe cada una? Escribe la fracción en la forma a/b.",
    "pasos": [
      { "texto": "3/4 ÷ 3 =", "esperado": "1/4" }
    ],
    "pistas": ["Dividir entre 3 es multiplicar por 1/3."],
    "explicacion": "3/4 × 1/3 = 3/12 = 1/4 de litro cada una."
  }
]
