[
  {
    "id": "enteros-multiplicacion-division-01",
    "modulo": "enteros",
    "subtema": "multiplicacion-division",
    "dificultad": 1,
    "tipo": "numerico",
    "enunciado": "Calcula: (−6) × (−4)",
    "respuesta": 24,
    "pistas": ["Signos iguales dan resultado positivo."],
    "explicacion": "(−6) × (−4) = 24."
  },
  {
    "id": "enteros-multiplicacion-division-02",
    "modulo": "enteros",
    "subtema": "multiplicacion-division",
    "dificultad": 1,
    "tipo": "numerico",
    "enunciado": "Calcula: 7 × (−3)",
    "respuesta": -21,
    "pistas": ["Signos distintos dan resultado negativo."],
    "explicacion": "7 × (−3) = −21."
  },
  {
    "id": "enteros-multiplicacion-division-03",
    "modulo": "enteros",
    "subtema": "multiplicacion-division",
    "dificultad": 2,
    "tipo": "numerico",
    "enunciado": "Calcula: (−48) ÷ 8",
    "respuesta": -6,
    "pistas": ["Misma regla de signos que la multiplicación."],
    "explicacion": "(−48) ÷ 8 = −6."
  },
  {
    "id": "enteros-multiplicacion-division-04",
    "modulo": "enteros",
    "subtema": "multiplicacion-division",
    "dificultad": 2,
    "tipo": "numerico",
    "enunciado": "Calcula: (−36) ÷ (−9)",
    "respuesta": 4,
    "pistas": ["Signos iguales en la división también dan resultado positivo."],
    "explicacion": "(−36) ÷ (−9) = 4."
  },
  {
    "id": "enteros-multiplicacion-division-05",
    "modulo": "enteros",
    "subtema": "multiplicacion-division",
    "dificultad": 2,
    "tipo": "opcion-multiple",
    "enunciado": "¿Cuál es el signo del resultado de (−5) × (−3) × (−2)?",
    "opciones": [
      { "id": "a", "texto": "Positivo" },
      { "id": "b", "texto": "Negativo" }
    ],
    "respuesta": "b",
    "pistas": ["Multiplica de a dos: primero (−5)×(−3), y a ese resultado multiplícalo por (−2)."],
    "explicacion": "(−5)×(−3)=15 (positivo); 15×(−2)=−30 (negativo). Con un número impar de factores negativos, el resultado es negativo."
  },
  {
    "id": "enteros-multiplicacion-division-06",
    "modulo": "enteros",
    "subtema": "multiplicacion-division",
    "dificultad": 3,
    "tipo": "numerico",
    "enunciado": "Un buzo desciende 4 metros cada minuto. ¿A qué profundidad está después de 6 minutos? (expresa la profundidad como número negativo)",
    "respuesta": -24,
    "pistas": ["Descender es un cambio negativo; repetirlo 6 veces es una multiplicación."],
    "explicacion": "(−4) × 6 = −24, es decir, 24 metros bajo la superficie."
  },
  {
    "id": "enteros-multiplicacion-division-07",
    "modulo": "enteros",
    "subtema": "multiplicacion-division",
    "dificultad": 2,
    "tipo": "numerico",
    "enunciado": "Una empresa pierde $12.000 cada día durante 5 días. ¿Cuál fue el cambio total en su saldo?",
    "respuesta": -60000,
    "pistas": ["Perder cada día es un cambio negativo; repetirlo 5 veces es una multiplicación."],
    "explicacion": "(−12.000) × 5 = −60.000."
  }
]
